place_id,author,rating,time,text,name,address
ChIJVUDRhwQKkEcRBS11mCXWVSc,Giorgia Cappellotto,4,3 weeks ago,The food is amazing and extremely fresh: simple and unrefined ingredients every day for a perfect bowl or bagel! I do recommend to try everything whenever you want something healthy and easy to digest.,Juicery 21,"Sihlstrasse 93, Zürich"
ChIJVUDRhwQKkEcRBS11mCXWVSc,D Briez,5,2 months ago,"I asked lots of questions.  Juices are not pastured, made fresh daily in the downstairs kitchen.  Oats on the granola are certified gluten free.  Lots of gluten free option. Very nice about answer questions and showed price in quality. They speak English's well.  I tried the quinoa bowl with added avocado and egg.  It was perfect. So fresh and delicious.  I also had the green juice and orange juice.  Both great.  As soon as I'm done eating, I will purchase a few things to take back to the Airbnb for later!  What a great tiny little find!  Love supporting places like this. ♥️",Juicery 21,"Sihlstrasse 93, Zürich"
ChIJVUDRhwQKkEcRBS11mCXWVSc,Patrick,5,a week ago,"The smoothie was perfect. They make their own almond milk in house for the smoothies. The cold Pressed juices are fresh and have the dates on them that they were made, and they're bottled in glass bottles.",Juicery 21,"Sihlstrasse 93, Zürich"
ChIJVUDRhwQKkEcRBS11mCXWVSc,Shawn L,5,a month ago,"Very nice selection of juices, coffee drinks, meal items for health conscious people. The quality and taste of the products are great. Very friendly and helpful staff.",Juicery 21,"Sihlstrasse 93, Zürich"
ChIJVUDRhwQKkEcRBS11mCXWVSc,Tim S,4,5 months ago,"Really Nice Café! (or juicery!) I really liked the vibe! Even thought it was cold it felt like a nice spring afternoon. Whenstaff was very friendly and we got our order quite fast.

We ordered a flat white which was nice and above average and one of the shakes. This one though was much on the milky side. Just from being there and being able to see how they make it I expected a bit of a tastier shake. You could almost not taste any fruit!

Nevertheless it was nice and we will most probably be back some day if we walk by coincidence and feel like it. Still need to try one of their bagels.",Juicery 21,"Sihlstrasse 93, Zürich"
ChIJg8Fl8AuhmkcR1tjF-xn5Zog,Xavier,5,3 months ago,"Really nice & cute place! Love the Flat White, the Juices (try the „Just Greens“!)
I appreciate the place because they also serve smoothies with proteins 🙌",Honest Smoothies,"Torgasse 5, Zürich"
ChIJg8Fl8AuhmkcR1tjF-xn5Zog,Pam Fetzer,5,2 weeks ago,"My favorite place in the center of town to grab a quick matcha, fresh juice, or smoothie! The products are super high quality and the staff are very kind and welcoming.",Honest Smoothies,"Torgasse 5, Zürich"
ChIJg8Fl8AuhmkcR1tjF-xn5Zog,Sophia Hunziker,3,a month ago,"Really nice workers and great aesthetic decor, but the smoothie was lacking sadly. The collagen/protein taste was way too overpowering and the price is 15.- cannot be justified considering that it is just fruit with some collagen/protein powder…",Honest Smoothies,"Torgasse 5, Zürich"
ChIJg8Fl8AuhmkcR1tjF-xn5Zog,R. Stocker,5,3 months ago,"We stopped by and were seriously impressed!

We ordered the Berry Glow and Coconut Cloud, both were incredibly fresh, flavorful, and not overly sweet. However, our kids loved them so much, we barely got a sip ourselves, so have to go back ordering more shakes.

Nice.",Honest Smoothies,"Torgasse 5, Zürich"
ChIJg8Fl8AuhmkcR1tjF-xn5Zog,Zischtigs Club,5,3 months ago,Finally a good juice/smoothie bar in the center of zurich and then right next to Bellevue. That's what was really missing. The smoothie was great and the juices were fresh and delicious. I will be back - it is a lifestyle!,Honest Smoothies,"Torgasse 5, Zürich"
ChIJ9W_2veULkEcR7FWx9jERI_o,Terrain Edwards-Grant,5,2 months ago,"Last week, my fiancée and I visited Zurich for the first time and had to stop by Blooming Juice as it was down the street from our Airbnb. We thought we'd walk in and out but Mara is FULL OF LIFE and wisdom. We were lucky enough to catch her juicing Tiger Nuts and it was delicious. We entered as customers and strangers...left with hugs.

Thank you Mara ❤️

Highly recommend.",Blooming Juice,"Weinbergstrasse 168, Zürich"
ChIJ9W_2veULkEcR7FWx9jERI_o,Robbyn Taylor,5,3 months ago,"This was a great experience! Mara is welcoming business owner and knowledgeable about the health benefits of her product. It was great to have nearby access to healthy nutrients while we in Zurich, we’re so glad we found her shop!",Blooming Juice,"Weinbergstrasse 168, Zürich"
ChIJ9W_2veULkEcR7FWx9jERI_o,Charlotte Wyss,5,2 weeks ago,"Was feeling a bit down and ill and Mara knew exactly what to do and made the perfect juice that tasted amazing.
Thx lots dear ♡",Blooming Juice,"Weinbergstrasse 168, Zürich"
ChIJ9W_2veULkEcR7FWx9jERI_o,Yana Romlein,5,2 months ago,"The juice is one of a kind, the owner, Mara, is the true gem— always so warm and welcoming and ready to prepare what your body needs✨",Blooming Juice,"Weinbergstrasse 168, Zürich"
ChIJ9W_2veULkEcR7FWx9jERI_o,Devon Wemyss,5,6 months ago,"Next level juice- no apple juice and ice filler, but fresh pressed goodness. It even has some thickness to it, not watery, and really gives a boost. I have been going by regularly for a few months and can highly recommend the pick-me-up.",Blooming Juice,"Weinbergstrasse 168, Zürich"
ChIJ1WzdqqugmkcRWEmMeuSKrE8,Eszter Polgár,5,2 weeks ago,It was my first time trying out the brand which I heard about previously. I wasn’t let down. I got a summer edition iced blueberry latte which was really tasty. The stuff knew English very well and they were friendly. I would recommend this place.,JOE & THE JUICE,"Schifflände 26, Zürich"
ChIJ1WzdqqugmkcRWEmMeuSKrE8,Andreea Tudor,5,a month ago,Took the joe’s club sandwich and the steak - were super tasty! I also enjoyed the signature juice green shield 😊.,JOE & THE JUICE,"Schifflände 26, Zürich"
ChIJ1WzdqqugmkcRWEmMeuSKrE8,Christian Tohmé,4,a year ago,"I wasn't familiar with the place and followed my daughter's (hungry) lead since she had heard about the brand.

My verdict: really tasty sandwiches & yummi juices, served in a nice interior by friendly, English-speaking staff. 🥪🥤

If you're okay with high-end prices (hey, it's Zurich), it's definitely worth a visit!",JOE & THE JUICE,"Schifflände 26, Zürich"
ChIJ1WzdqqugmkcRWEmMeuSKrE8,Piotr Pyszkowski,5,a year ago,Nice place to grab a juice and sit down outside in the full sun looking at the Zürich. All the fresh ingredients make it good energized experience. A lot of space to sit down inside as well with the cozy atmosphere.,JOE & THE JUICE,"Schifflände 26, Zürich"
ChIJ1WzdqqugmkcRWEmMeuSKrE8,dj sal,5,a year ago,"I was in dire need of hydration and something tasty. I walked in and immediately fell in love with the atmosphere. Staff suggested a drink and from the first taste I couldn't put my drink down. I had to order another! Prices are reasonable for such nutritional drinks! Did I mention there is food? The cherry on top MANY OUTLETS TO CHARGE YOUR ELECTRICS!
Come by and enjoy a refreshing snack
INKtoxicatedDJ approved!",JOE & THE JUICE,"Schifflände 26, Zürich"
ChIJW-eeB44LkEcR8hTnii7jt8U,D Briez,5,2 months ago,We saw this place outside the window of our Airbnb across the street!  The couple behind the counter were super welcoming and knowledgeable about food allergens. I had no problem getting a dish gluten-free. My husband and I shared an açai bowl and devoured it.  We will be back for breakfast tomorrow!,Dabo Smoothies,"Birmensdorferstrasse 285, Wiedikon"
ChIJW-eeB44LkEcR8hTnii7jt8U,Sergi videbook,5,2 months ago,"Visiting Dabo Smoothies was a total surprise. I had walked past it so many times without really paying attention, and never thought about going in… until now. And what a discovery!

From the moment I stepped in, the atmosphere won me over — cozy, relaxed, and full of good vibes. The food was just as impressive: everything I tried was delicious, fresh, and, best of all, healthy. You can really tell they put care into everything they make.

Plus, it’s just around the corner from my house, so I’ll definitely be stopping by often. I’m really glad I decided to give it a try. Highly recommended.",Dabo Smoothies,"Birmensdorferstrasse 285, Wiedikon"
ChIJW-eeB44LkEcR8hTnii7jt8U,Daniel Partida,4,2 months ago,"The açai tastes really good, the place is cutr and the staff is friendly.

Giving 4 stars instead of 5 because the portions are very small and the mango inside of the bowl is from a can. These two points makes it worth 4 stars but never 5.

Very impressed on the amount of reviews saying is the best ever, it is good but not the best.",Dabo Smoothies,"Birmensdorferstrasse 285, Wiedikon"
ChIJW-eeB44LkEcR8hTnii7jt8U,Angelita DeCapa,5,a month ago,"Amazing, fresh healthy food and a very friendly, personal, warm vibe, definitely my new hot spot in Zurich. Best Açai Bowl and juice selection in Switzerland, also the Tapioca was so good. The two people working there were so nice and warmhearted, I could have stayed all day in there.",Dabo Smoothies,"Birmensdorferstrasse 285, Wiedikon"
ChIJW-eeB44LkEcR8hTnii7jt8U,Jacob Brown,5,3 months ago,The best açaí bowl in Switzerland! Everything was so fresh and workers very friendly.,Dabo Smoothies,"Birmensdorferstrasse 285, Wiedikon"
ChIJncjoIRyhmkcRYLPMfGGWep8,behy yavi,5,a month ago,"The Space:
Spacious sitting area, friendly people working there.
The Food:
In Joe & The Juice: When Tuna Fish meets Avocado, they blend into a deliciously grilled sandwich which they have creatively named: ‘Tunacado’! Has a good texture, unlike 99% of tuna sandwiches, this one actually tastes well. And, most importantly: You could have their ‘Pick me Up’ smoothie, which does not chemically collide with it! Kidding: Their combination suits your gut and gives it the good feeling it needs😂!
&
That’s like a good Dane tale, and that I’d tell!
Unwrap the sandwich, and you’d find join therein!",JOE & THE JUICE,"Limmatquai 70, Zürich"
ChIJncjoIRyhmkcRYLPMfGGWep8,Katie Doble,2,a month ago,"We were so excited to see açaí bowls on the menu and added protein powder as it was an option. The açaí was rock solid and the powder was dumped on top vs blended in. When I complained that the bowl wasn’t edible and the powder wasn’t blended in, I got a blank stare, like “what did you expect.” Super disappointing. Especially given the price $$$. My sister got a smoothie and liked it.",JOE & THE JUICE,"Limmatquai 70, Zürich"
ChIJncjoIRyhmkcRYLPMfGGWep8,Teresa Anaya,5,3 months ago,"Excellent location with view of river, big enough for room move, plenty of seating inside, limited seating outside with river view in Old Town Zurich.  Coffee was excellent.",JOE & THE JUICE,"Limmatquai 70, Zürich"
ChIJncjoIRyhmkcRYLPMfGGWep8,Naresh Hinduja,4,6 months ago,"Great little place for coffee with cool vibes. light chill music and great selection of coffee, juice and food. I enjoyed the avocado toast with tomatoes, cheese, avocado on a wheat pita bread thingey . Very light, filling and satisfying. Great little find on my journey.",JOE & THE JUICE,"Limmatquai 70, Zürich"
ChIJncjoIRyhmkcRYLPMfGGWep8,Emilka,5,a month ago,Great service. The sandwich and the juice were really good. You can feel the quality of the ingredients. Definitely recommended.,JOE & THE JUICE,"Limmatquai 70, Zürich"
ChIJXQZC1wYLkEcRYMBNvRP782A,Grace Yang-Koshiba,5,3 weeks ago,"I’ve been here on number of occasions and this place never disappoints me. The positive vibe and warm service here are unparalleled. I wish to give my special acknowledgment to Allan.. we asked him if it would be possible to prepare us two Joe clubs and 2 juices since we were rushing to hop on the train, and not to mention a massive cue in front of us.. with such ease, kindness, and absolute smile he immediately prepared them for us… an incredible customer service ever!!! Thank you so much, Allan!! You’re the best!!!!",JOE & THE JUICE,"Sihlstrasse 37, Zürich"
ChIJXQZC1wYLkEcRYMBNvRP782A,Monika Lagnaux,1,a month ago,"It is really, really sad that I have to write this about Joe and the juice. I really love the place and I go there quite often. But today I had a really terrible experience. I have ordered avocado sandwich as I always do and ginger shot too. The bread that is usually thin, toasted and crispy it was nothing like that, if anything it was just warm, with thick slices, that hardly have seen the toaster.  And Joe the juice is known for the bread that is thin and crispy. Of course it was edible, but it was just an ordinary sandwich that anyone can make it at home. Ginger shot that I got it was an apple juice with a hint of ginger in it. I did get the order very fast which surprised me because I usually wait longer for the obvious reasons, because it takes time four the bread to be toasted. But I guess they wanted to speed up the process and get rid of the long queue of people. They were just making these sandwiches as fast as they could. That is absolutely wrong and not what Joe end the juice is about. Everyone who is coming to get sandwiches, salads or juices are expecting to get what they’re paying for. What a shame.",JOE & THE JUICE,"Sihlstrasse 37, Zürich"
ChIJXQZC1wYLkEcRYMBNvRP782A,Nesreen S. W.,5,3 weeks ago,"This the best branch ever , Bread is amazing crunch and thin very light ..
special thanks for Ms Sofia she was so Lovely, respected, and dedicated with nice smile . Ahed recommended for us few suggestions
Sandwich  tuna and Avocado with match was so delicious..
thanks for making our day in very raining weather",JOE & THE JUICE,"Sihlstrasse 37, Zürich"
ChIJXQZC1wYLkEcRYMBNvRP782A,Justin Shircliff,4,6 years ago,"I really liked the vibe of this place. The ceilings were high, the decorations interesting, and the music good. The staff was nice and service was fast. The sandwich was pretty good, but 10 CHF seemed a little steep. Maybe that’s normal in Zurich. Drinks looked nice as well. I’d still say give this place a try.",JOE & THE JUICE,"Sihlstrasse 37, Zürich"
ChIJXQZC1wYLkEcRYMBNvRP782A,Loukpad Bansit,4,3 years ago,"#Wheelchair #accessible nice and quick smoothie and friendly for my mom.
If you are looking for toilet where wheelchair accessible and convenience to take care elderly. Just stop here and hide away from a hot day.",JOE & THE JUICE,"Sihlstrasse 37, Zürich"
ChIJbTpyy_EJkEcR2SDKU6UpuHI,Kelvin Ibrahim,5,2 months ago,"Diana the manager surprised me today with her kindness. Never received a free coffee in like forever, I got into Zurich and needed a place to stay before my check-in time. I stayed in the stores for a few hours after having yoghurt, I was expecting them to chase me away at a point but Diana came and handed me coffee on the house. I was shocked but very thankful. I needed that little act of kindness today, thanks Diana and the team.",JOE & THE JUICE,"Kalandergasse 4, Zürich"
ChIJbTpyy_EJkEcR2SDKU6UpuHI,Dilexshan S,5,a year ago,"Joe & The Juice offers a delightful variety of tasty foods, shakes, juices and Sandwiches each with a unique flavor profile that stands out.

The Power Shake and nutrition-rich juices are my personal favorites, and their cappuccinos, brownies, and muffins are irresistible.

The atmosphere is clean and inviting, which enhances the dining experience. Additionally, the customer service here is good, always friendly and helpful. Although the prices are a bit on the higher side, the quality and taste of the offerings make it worthwhile. Highly recommend for a refreshing culinary experience!",JOE & THE JUICE,"Kalandergasse 4, Zürich"
ChIJbTpyy_EJkEcR2SDKU6UpuHI,Radu Zamfir,5,9 months ago,"I love having brunch here!

Very nice service, tasty sandwiches, good cappuccino and a nice area to relax in! What more is there to want from such a place? Even though this is mainly a shake place, they still put the effort in all other items they offer.

This was my to-go coffee+sandwich place for the past months in Zurich, and I totally recommend it!!",JOE & THE JUICE,"Kalandergasse 4, Zürich"
ChIJbTpyy_EJkEcR2SDKU6UpuHI,Antonio,5,4 years ago,"My girlfriend and I are regular Joe & The Juice’s customers and we’ve been to their branches all around the world (NYC, London, Singapore, Sweden, Norway, Denmark and now Switzerland). We really love the brand and the idea and would highly recommend their juices.

A couple of points of feedback relevant to this particular store. We went on a Saturday afternoon and there was only one girl serving which is clearly not enough given the number of customers. As a result, we had to wait quite a bit because they were understaffed. Secondly, prices are slightly higher than in other countries but I guess that is because it’s Switzerland? 🤷‍♂️.

Overall, the experience was positive and in line with other Joe & The Juice branches.",JOE & THE JUICE,"Kalandergasse 4, Zürich"
ChIJbTpyy_EJkEcR2SDKU6UpuHI,Julian Toedter,4,3 years ago,"Located in the shopping and leisure district of Sihlcity, we got takeaway at Joe & the Juice after always seeing this around Europe and the US but never trying. We finally gave it a shot... Staff are friendly and service was quick.

Sandwiches, coffee and juices were all good. We were happy with our order. We had the tuna and chicken avocado sandwiches which were tasty, cappuccino was solid and the Go Away Doc juice definitely felt like it gave us a health boost!",JOE & THE JUICE,"Kalandergasse 4, Zürich"
ChIJC-fPnRULkEcRXbWPYee5riA,Kaja Kocherhans,1,4 months ago,"Do not  go there. We were there at 11 am on a Sunday, the music was way too lound and the tables looked horrible so we decided to order take away since we normally like Joe and the Juice. We ordered two iced matcha lattes and they tasted like milk - not worth the 16 francs spent.",JOE & THE JUICE,"Badenerstrasse 9, Zürich"
ChIJC-fPnRULkEcRXbWPYee5riA,Tais Cunha,5,4 months ago,"Great vibes, super friendly staff, and delicious juices! The team is always welcoming and helpful, making great recommendations. I had the Joe’s Green Mile, and it was super fresh and tasty. Perfect spot for a quick, healthy stop. Highly recommend!",JOE & THE JUICE,"Badenerstrasse 9, Zürich"
ChIJC-fPnRULkEcRXbWPYee5riA,Mikhail J,1,a month ago,+30 degrees inside the store. Even higher than outside. I feel bad giving 1 star because food was good and employees nice but this is too much. Had to finish my food home because I couldn’t stay there.,JOE & THE JUICE,"Badenerstrasse 9, Zürich"
ChIJC-fPnRULkEcRXbWPYee5riA,Nicola Keller,1,a month ago,"I ordered a juice and a brownie. The brownie tasted like glue to me. I ate one bite and tried ti give it back. The reaction was rude...that is not the way it works for us! He said. And then he tried to offer me something else. I paid 14.45 for a juce...and 4.95 for a brownie that i left on the counter.
Whole experience just a waste of money and time",JOE & THE JUICE,"Badenerstrasse 9, Zürich"
ChIJC-fPnRULkEcRXbWPYee5riA,Astrid Robertsson,1,4 months ago,"The food was edible and tasted like other Jos and the Juices. That gets the star this review gave.

Service however was dismal. I thought they were just having an “off” day but based on other reviews it seems this is the standard here. The staff were rude, treated customers like they’re a nuisance for being there and ordering even though that’s the point of a cafe/lunch place. Went because it was near a place I need to go often but never going to this one again. If I’m going to spend Swiss prices for a sandwich I would like the person selling it to at least not be rude or procrastinate making it because she’d rather talk to her coworker",JOE & THE JUICE,"Badenerstrasse 9, Zürich"
ChIJR-F7Ht4LkEcRcjFX0MeE1yM,Christie,5,2 months ago,"i’ve been to many açaí places in zurich, and this spot definitely has one of the best açaí bowls in town. it is on the pricier side, but from what i’ve seen, that’s pretty standard for zürich.

you can fully customise your own bowl if the preset options aren’t quite your thing, which i really appreciate. the staff have always been friendly and welcoming since my first visit. overall, a place i genuinely enjoy coming back to.",Wild Bowls,"Bleicherweg 50, Zürich"
ChIJR-F7Ht4LkEcRcjFX0MeE1yM,Mouss,1,a month ago,"Disappointed by the quality of the salmon.

I ordered a salmon poke bowl expecting fresh, sushi-grade fish. Instead, they used packaged supermarket-style salmon with no flavor and an odd reddish color. Definitely not worth the price (CHf 30).

The pictures speak for themselves…",Wild Bowls,"Bleicherweg 50, Zürich"
ChIJR-F7Ht4LkEcRcjFX0MeE1yM,Mr Blonde,4,3 weeks ago,"Only predefined bowls, not possible to customize ingredients. The smoked salmon was not my cup of tea, chicken — only faux option for vegan. Although the ingredients were very fresh i would not call the experience as enjoyable.",Wild Bowls,"Bleicherweg 50, Zürich"
ChIJR-F7Ht4LkEcRcjFX0MeE1yM,Sara Zani,5,6 months ago,"They mistakenly put my bowl in the take away one instead in the normal plate to eat in, but beside that the meal was delicious. The Mexican bowl is fantastic and the portion huge! Highly recommended.",Wild Bowls,"Bleicherweg 50, Zürich"
ChIJR-F7Ht4LkEcRcjFX0MeE1yM,Daniel Partida,5,2 months ago,"No doubt at all, this is legit the best açai bowl in Zurich. The granola and the açai also feel healthy, all fresh ingredients and the portions are very generous. Will come back here often 😋",Wild Bowls,"Bleicherweg 50, Zürich"
ChIJGaveEqALkEcRtMU1t4rvQpE,Julia Gonzalez,1,3 months ago,"Went there 2 days in a row and it was closed on both days. Waste of my time. At least update the working hours on your website. I only went the next day because there was an “updated” note on the door, but the hours according to the note weren’t true either. Really unprofessional. Will not try their juices.",Daily Fresh,"Franklinstrasse 7, Zürich"
ChIJGaveEqALkEcRtMU1t4rvQpE,Noelia Tschudi,5,7 months ago,"Great customer service, very friendly. Great drinks and sandwiches.",Daily Fresh,"Franklinstrasse 7, Zürich"
ChIJGaveEqALkEcRtMU1t4rvQpE,Flavia Rozina Mihai,5,11 months ago,The cold pressed juices are my favorite ones ❤️Also a big thumb up for the Açaí bowls (yummy)🫶,Daily Fresh,"Franklinstrasse 7, Zürich"
ChIJGaveEqALkEcRtMU1t4rvQpE,Mathilde Reichenbach,5,a year ago,"Super fresh juices, lovely owner - good addition to the Oerlikon area! Worth a visit.",Daily Fresh,"Franklinstrasse 7, Zürich"
ChIJGaveEqALkEcRtMU1t4rvQpE,Simona,5,a year ago,Delicious & fresh smoothie 😍 and very friendly staff!,Daily Fresh,"Franklinstrasse 7, Zürich"
ChIJt2--ZwALkEcRd7Cv_csTI-Q,Dilexshan S,4,2 months ago,"Oakberry is a great place to enjoy healthy, vitamin-rich food and drinks. The atmosphere is modern and inviting, perfect for a quick, nutritious break.

They offer a variety of açaí bowls and smoothies with fresh, high-quality ingredients. While the menu is limited, the options are well-curated and satisfying.

Conveniently located near Jelmoli in Zurich, it’s a great spot for anyone looking to grab something healthy on the go. Highly recommended!",Oakberry,"St. Annagasse 18, Zürich"
ChIJt2--ZwALkEcRd7Cv_csTI-Q,Jan Dreher,1,3 weeks ago,WHAT A SCAM! We ordered through uber eats and they are not refunding us the money. The acai bowl was completely liquid.,Oakberry,"St. Annagasse 18, Zürich"
ChIJt2--ZwALkEcRd7Cv_csTI-Q,Giama,4,3 weeks ago,"Had an acai bowl. Great taste, the ingredients are also of excellent quality. However, the „healthy“ bowls are rather sweet, sugar content at the upper limit (check amount of added sugar!). If your definition of healthy is colors, fruits and sugar, that’s the right place for you. The service was friendly. If large groups turn up, you can expect longer waiting times.",Oakberry,"St. Annagasse 18, Zürich"
ChIJt2--ZwALkEcRd7Cv_csTI-Q,Laura Smith,1,in the last week,"Service is great, but the açaí bowl here is consistently disappointing. After five visits, it’s always been served as a watery liquid, more like a juice than the thick, creamy frozen açaí Oakberry is known for. This isn’t a one-off, it’s the norm at this location. The product seems very diluted and turns to water within 30 seconds of being handed to you. Having enjoyed Oakberry bowls in multiple countries, I can say Switzerland is far from the brand’s standard, and as a fellow Latin American, it’s sad to see Brazil’s açaí so poorly represented. Adding photos and videos to share liquid consistency right after being handed to me. The store keeps açai between 8C-11C, when it should be around 5-6C.",Oakberry,"St. Annagasse 18, Zürich"
ChIJt2--ZwALkEcRd7Cv_csTI-Q,Shiami Thayalakumar,5,a month ago,"Refreshing smoothies and a cozy vibe!”
I visited Oakberry Zurich this afternoon and had a really nice experience. It wasn’t too busy, so we got our smoothies quickly — and they were delicious! We really enjoyed the relaxed atmosphere. There are enough tables and cozy spots to sit back and enjoy your snack.

The staff were super friendly and cheerful, always ready to help with a smile, which made the visit even better. The only thing that could be improved is the overall tidiness — a quick cleanup of the seating area would make it feel even more inviting.

Overall, a lovely place for a healthy treat in the city. I’d definitely come back!",Oakberry,"St. Annagasse 18, Zürich"
ChIJofWCl5cLkEcR4hEbJfrbjMY,Nicolas Heynen,1,a week ago,"They tell you to Download the app to receive a free sandwich the next time you come. When you come next time, they tell you it was only valid the initial time. So you end up with nothing out of the offer. Overpriced paninis for bad service",JOE & THE JUICE,"Beethovenstrasse 33, Zürich"
